Trump claims he will ‘protect’ women — women need to protect themselves from Trump,2024-11-04 17:07:47,D
The Surprising List Of Republicans and Conservatives Who Turned Their Back on Trump For Kamala,2024-11-04 22:09:24,D
Why a Dan Osborn victory in Nebraska Senate race may not be a win for any party,2024-11-04 20:40:11,N
Elders are removed from Texas megachurch in latest fallout from Trump pal’s sex abuse scandal | Robert Morris previously served on Donald Trump’s faith advisory board,2024-11-04 22:40:22,D
I am an Arab American Voting for Kamala Harris,2024-11-04 15:28:12,D
Trump warns voters that his second term would get ‘nasty’ at times,2024-11-04 00:26:23,R
"More than 740,000 voted in early voting in CT",2024-11-04 04:55:40,N
Trump or Harris: Either Way Expect a Transatlantic Trade Tussle,2024-11-04 08:52:22,N
"'Blah, blah, blah': Will Ferrell releases political ad for Harris  ",2024-11-04 21:34:50,D
‘He’s realizing that he could lose’: Harris’s people are confident. The Trump campaign is panicking,2024-11-04 15:15:36,D
"Trump says ‘I shouldn’t have left’ White House, despite losing 2020 election",2024-11-04 20:05:21,R
Nevada analyst says Kamala Harris wins swing state in final prediction,2024-11-04 19:06:34,D
US election offices increase security measures amid ongoing threats,2024-11-04 18:19:47,N
"Trump’s closing campaign message is hampered by distractions, disconnect",2024-11-04 20:35:31,D
"Russia feigns indifference over U.S. election but roots quietly for Trump | Trump’s international agenda is more to the Kremlin’s tastes, but even his plans for ending the war in Ukraine might not be acceptable to Putin.",2024-11-04 22:09:12,R
A 109-Year-Old Survivor Of The Tulsa Race Massacre Just Cast Her Ballot. It's My Favorite Story Of The Year.,2024-11-04 22:08:12,N
Was Trump operative caught lying about poll numbers?,2024-11-04 16:55:50,N
'It's all about him': Former Trump adviser,2024-11-04 15:27:10,R
Trump camp touts GOP early voting gains ,2024-11-04 18:39:14,N
Trump campaign acknowledges to staffers: He could lose,2024-11-04 20:28:06,N
Controversial San Francisco church doing $6.1B giveaway for Election Day,2024-11-04 11:49:53,N
"Early voting in Kentucky concludes with record-high turnout, nearly 792,000 votes cast",2024-11-04 00:39:55,N
Kamala’s Green New Deal wreaks havoc on Native American jobs and families - Navajo Times,2024-11-04 13:16:57,N
Donald Trump Met With Empty Seats at Final Rallies,2024-11-04 15:06:04,N
Trump’s Anti-War Charade Deserves a Challenge,2024-11-04 18:38:39,N
Musk-linked Pac accused of targeting Jewish and Arab Americans in swing states | US elections 2024,2024-11-04 20:14:48,N
Democratic National Committee vice chair: ‘We’re prepared’ for close race,2024-11-04 15:47:17,N
We’ve Been Underestimating the Scale of Women’s Fury,2024-11-04 20:31:07,N
"Tucker Carlson warns Elon Musk ""will be destroyed"" if Kamala Harris wins",2024-11-04 19:39:59,N
What are Harris and Trump's policies?,2024-11-04 14:22:19,N
Iowa Poll: Democrats are preferred over Republicans in 2 of 4 congressional districts,2024-11-04 10:59:10,N
This race is close but I'm predicting Donald Trump wins the Electoral College -- and possibly the popular vote,2024-11-04 12:59:42,R
Chasing the Vote: How the Illegal-Immigration Debate Plays in Pennsylvania (Podcast),2024-11-04 17:44:36,N
Harris and Trump make a furious final push before Election Day,2024-11-04 14:05:21,N
"New Pew Research Survey Shows Americans’ Main Source for Political News is Fox News, and CNN",2024-11-04 07:18:20,N
I’m a PEOPLE Writer Who Was Attacked by Trump. Don’t Underestimate Women This Election,2024-11-04 14:19:12,D
Democratic senator: Trump is having a ‘thermonuclear meltdown’,2024-11-04 03:32:55,D
The 20 Craziest Moments of the 2024 Presidential Race,2024-11-04 17:14:45,N
David Clements: The Evangelist of Election Refusal,2024-11-04 20:58:53,R
"Uber, Lyft and Others Offer Discounts for Election-Day Rides",2024-11-03 23:15:59,N
Trump will likely declare victory early. Don’t jump to conclusions.,2024-11-04 18:58:24,N
Benson asks for AG opinion in effort to use new election recount rules,2024-11-04 18:30:27,N
"GOP candidate Tim Sheehy says medical records don’t exist for gunshot wound – In May, the candidate said it was “insulting and ridiculous” that he would be asked to provide them.",2024-11-04 15:50:40,N
‘I Didn’t Do an About-Face on Pete Buttigieg. Buttigieg Did an About-Face on Me.’,2024-11-04 19:30:05,N
Republicans can save our country — and the party — by voting for Harris,2024-11-03 23:13:17,D
Nikki Haley pens supportive op-ed in favor of Trump ahead of Election Day: 'Easy call',2024-11-04 18:06:18,R
Donald Trump’s Hatred of Free Speech,2024-11-04 20:47:08,N
‘Let’s Go for It’: Tim Walz Eyes the End Zone,2024-11-04 16:00:06,N
What poll watchers can and can't do,2024-11-04 16:59:31,N
It Might be Too Late for Democrats to Win Back Latinos in Pennsylvania,2024-11-04 03:21:49,R
Trump's last-minute ad blitz on X is literally unavoidable—as opt-out options doing nothing,2024-11-04 21:00:11,N
"In a frank internal meeting, The New York Times wrestled with its political role | Semafor",2024-11-04 18:25:20,N
Obama Puts Trump's Laundry List Of 'Demeaning And Degrading' Comments On Blast,2024-11-04 18:20:31,N
Trump Claims “Illegal Alien” Voting Is Rampant. His Own Party Disagrees.,2024-11-04 15:33:07,N
Conservative Texas Megachurch Pastor Backs Harris in Last-Minute Op-Ed,2024-11-04 21:59:45,N
'Trump is even worse': Bernie urges pro-Palestinian voters to back Harris,2024-11-04 19:00:23,N
Biden Ends 2024 Race Having Done Just One Campaign Event with Harris,2024-11-04 15:17:36,N
Shock Poll: Even Arab Israelis Prefer Donald Trump over Kamala Harris,2024-11-04 01:41:49,N
"""I am scared every day"": Experts say GOP men targeting no-fault divorce to keep women ""trapped""",2024-11-04 11:45:22,N
Bernie Sanders: “Netanyahu Prefers to Have Donald Trump in Office”,2024-11-04 22:35:38,N
I am an Arab American voting for Kamala Harris,2024-11-04 18:59:10,D
Bizarre video of Rudy Giuliani in drag and Trump kissing his fake breasts resurfaces,2024-11-04 19:25:00,N
What Trump has actually done for Black Americans,2024-11-04 16:13:54,R
Trump Visibly Rattled as Surprise Polls Show Undecideds Move to Harris,2024-11-04 22:02:31,D
JD Vance mocked for saying he thinks Trump will win 'the normal gay guy vote',2024-11-03 23:08:07,N
Teary-Eyed John Oliver Begs Reluctant Voters to Back Kamala Harris,2024-11-04 17:14:06,D
Trump Says His Advisers Didn’t Let Him ‘Hit’ Michelle Obama,2024-11-04 16:31:33,R
Trump says he ‘shouldn’t have left’ the White House in 2021,2024-11-04 02:42:31,R
"Entire City Police Force in Oklahoma Quits as 2 Council Members Also Resign The reasons for the abrupt mass departures in the city of Geary, Okla., which has a population of just under 1,000, were unclear.",2024-11-04 20:19:41,N
"FCC commissioner rips NBC over Harris' last-minute SNL appearance: 'Plainly designed to evade' the rules 'We have rules on the books, we have to uphold them,' FCC commissioner Brendan Carr told Fox News Digital in a Zoom interview",2024-11-04 06:31:10,R
Walz Rallies Wisconsin Voters on Election Eve; Vance Makes La Crosse Debut,2024-11-04 19:08:46,N
"The Real Election Risk Comes Later | Amid heightened tensions, officials across the country are taking measures to keep voting secure and safe. It could be a long job",2024-11-04 20:58:15,N
Trump Rallies Draw Fewer Crowds as Election Campaign Winds Down,2024-11-04 17:13:27,N
"Marjorie Taylor Greene & J.D. Vance use OnlyFans’ Squirrel Dad to slam Dems -- P'nut the Squirrel is dead. His ""dad,"" Mark Longo, is an OnlyFans model who posts explicit adult content... but the GOP likes him??",2024-11-04 16:43:51,N
"Kathy Hochul labels New Yorkers who vote for Republicans 'anti-American,' 'anti-woman'",2024-11-04 18:13:25,D
‘Rabbi rebellion’: 33 Orthodox rabbis endorse Harris ,2024-11-04 15:23:49,D
Frustration over Mideast war in America's largest Arab-majority city may push some away from Democrats,2024-11-04 08:36:30,N
More Scots support Donald Trump than anywhere else in Europe,2024-11-04 18:11:05,N
Ann Selzer predicts a shock win for Kamala Harris in Iowa – here’s why it’s a big deal,2024-11-04 17:13:03,N
What's Going On With Black Male Voters?,2024-11-04 17:09:21,N
"Texas House candidate campaigning in churches, in potential legal violation",2024-11-04 17:31:35,N
"Elon Musk’s daily $1 million giveaway to voters can continue, Pennsylvania judge rules",2024-11-04 18:24:12,N
How does the Electoral College work? A simple explanation for the 2024 presidential election,2024-11-04 19:37:02,N
How Is It This Close?,2024-11-04 22:49:53,N
"When Trump says he’s going to ‘protect’ women, we know he means ‘control’",2024-11-04 00:08:14,N
Trump jokes assassin would have to shoot journalists as rally goes off the rails,2024-11-04 20:10:13,N
Trump’s Latest Lawsuit Against CBS Proves He’s No Free Speech Champion,2024-11-04 21:58:49,D
The most critical abortion ballot measures to watch this election,2024-11-04 21:22:58,N
Trump vs. Harris: Cities across US board up ahead of election,2024-11-04 16:19:28,N
Elon Musk lawyer says $1 million voter giveaway winners are not random,2024-11-04 09:05:00,N
Opinion: I'm voting for Kamala Harris. Donald Trump will harm people I care about.,2024-11-04 15:34:43,N
"In Georgia, it’s Republican vs. Republican as election misinformation spreads ",2024-11-04 03:43:53,N
"Elon Musk’s misleading election claims have been viewed more than 2 billion times on X, analysis finds",2024-11-04 13:22:48,D
"Trump Mocks Mitch McConnell for Endorsing Him, Then Forgets Where He Is",2024-11-04 17:42:02,N
"Drinking, death and assassination attempts: Inside SF's long presidential history",2024-11-04 20:52:27,N
Harris camp thinks she’s regained edge on Trump,2024-11-04 22:15:21,D
John Oliver Fights Back Tears Urging Viewers to Vote for Kamala Harris: ‘Wouldn’t It Be Great to Live in a World’ Where Trump Is ‘No Longer an Active Threat?’,2024-11-04 22:11:22,D
Kari Lake is struggling to match Trump’s numbers in Arizona. She doesn’t believe the polls.,2024-11-04 11:58:52,N
Trump claims every seat at his rally is full — but camera operator pans to many empty seats,2024-11-04 22:30:38,N
Elon Musk's influence over Trump is being closely watched by Beijing,2024-11-04 04:02:59,N
"Election Deniers were aimless. Now, with Musks help, they’re an army.",2024-11-04 02:24:27,D
Pete Buttigieg debates 25 undecided Michigan voters on why Kamala Harris is better,2024-11-04 16:57:46,D
Trump Rallies Draw Fewer Crowds as Election Campaign Winds Down ,2024-11-04 11:25:11,N
Harris won't say how she voted on California measure that would reverse criminal justice reforms,2024-11-04 18:47:58,N
Voter roll lawsuits offer insight into how Trump could challenge 2024 election result,2024-11-03 23:21:24,N
Trump Promises to Bring About a New Era of Christian Power,2024-11-04 22:25:46,N
Presidential candidates silent on overdose crisis beyond ‘war on drugs’ rhetoric: ‘It’s easier to point fingers’,2024-11-04 17:34:34,N
"Final Day's Campaign Stops: Harris, Walz, and Trump's Itinerary. Harris is All-In on PA. ",2024-11-04 15:39:59,N
The candidates’ closing campaign messages could not be more different,2024-11-04 01:03:37,N
Trump appears to forget he is in North Carolina,2024-11-04 18:42:58,N
The 9 Dates That Matter After Election Day,2024-11-04 05:30:00,N
Harris vows to end war in Gaza during final Michigan rally at MSU,2024-11-04 16:16:48,N
Supreme Court agrees to review Louisiana congressional map that favors Democrats,2024-11-04 18:24:22,N
Texas Republicans rally around P'Nut the Squirrel in last-ditch attempt for votes,2024-11-04 12:49:59,N
Federal judge lets Iowa keep challenging voter rolls although naturalized citizens may be affected,2024-11-04 16:10:24,N
"Fact Sheet: President Biden Announces 1.2 Million Pensions Protected Under Biden-⁠Harris Administration, Celebrates Historic Support for Unions",2024-11-04 18:00:01,D
Republicans bring back fake electors in battlegrounds,2024-11-04 19:28:38,D
How Americans Feel About the Election: Anxious and Scared,2024-11-04 01:12:11,N
Trump Is Unfit for the White House. Don’t Let Him Back In.,2024-11-04 19:18:11,N
Asian-American community’s support could help Kamala Harris win swing state Pennsylvania,2024-11-04 14:29:42,D
‘Trump would be the worst’: Palestinians react to US presidential race,2024-11-04 19:45:16,N
Republicans bring back fake electors in battlegrounds ,2024-11-04 16:21:48,D
Fact check: Trump begins final full day of campaign with repeat lies about immigration and jobs,2024-11-04 12:42:50,D
How would Kamala Harris govern? Her past career offers signals.,2024-11-04 03:41:21,N
"Discussion Thread: Polling and News Updates for November 4, 2024",2024-11-04 14:24:42,N
"Donald Trump's chances of winning a landslide, according to Nate Silver",2024-11-04 17:11:34,N
Why the Right Thinks Trump Is Running Away With the Race,2024-11-04 22:17:26,R
"Harris, Obamas and voting rights leaders work to turn out Black voters in run-up to Election Day ",2024-11-04 14:37:00,D
Trump is terrible for women — but that doesn't mean he's good for men,2024-11-04 00:00:34,N
I was Stephen Miller's rabbi. Here's why I'm voting for Kamala Harris,2024-11-04 21:52:26,D
"""Women are not without electoral or political power"": Samuel Alito's words come back to haunt Trump",2024-11-04 14:04:30,D
All the battleground states to watch during the 2024 election,2024-11-04 11:59:18,N
"Security fencing goes up around White House, Capitol, VP residence",2024-11-04 17:59:02,N
"North Carolina is a swing state, so why are its top GOP candidates far-right MAGA extremists?
",2024-11-04 18:40:57,D
NBC airs video message from Trump in apparent bid to provide equal time after Harris SNL appearance,2024-11-04 15:38:26,N
Elon Musk’s ‘crazy’ plan to rip $2 trillion out of America,2024-11-04 22:06:07,N
Elon Musk’s lawyer says $1m-a-day giveaway winners not chosen at random,2024-11-04 19:39:19,N
Why Isn’t Trump Running Away With This?,2024-11-04 21:17:57,N
Fact Sheet: National Strategy for Financial Inclusion in the United States,2024-11-04 21:28:24,N
"Donald Trump should accept result and ‘go play golf’ if Kamala Harris wins, says Nigel Farage",2024-11-04 16:12:01,N
Republican Senate hopeful Tim Sheehy admits no records back war wound claim,2024-11-03 23:58:52,N
‘We’re mad’: How women are driving the vote in WA’s bellwether county,2024-11-04 13:56:54,N
What It’s Like To Be Rachel Maddow On Election Night,2024-11-04 21:07:40,N
"US truce efforts on Lebanon fail ahead of election, diplomatic sources say",2024-11-04 19:12:13,N
Barack Obama Tries Debunked ‘Very Fine People’ Hoax in Closing Message,2024-11-04 12:58:55,N
Elon Musk’s election-doubting posts are shared 9 times more than his less extreme election content,2024-11-04 21:21:20,N
"Florida will vote on marijuana, abortion in an election that will test GOP's dominance",2024-11-04 15:47:38,N
Megyn Kelly Comes Out as Full-On MAGA by Rallying With Trump,2024-11-04 12:35:06,R
'Painstaking process': Pa. county gives update on probe of suspicious batch of voter forms At least 17% of the suspicious voter registrations and ballot applications have been confirmed as fraudulent,2024-11-04 17:01:09,N
"Class struggle election: The billionaires bet on Trump, but we’re betting on workers",2024-11-04 23:01:36,D
Rep. Omar Joins War Powers Letter to President Biden,2024-11-04 13:22:02,N
Here’s Why Trump’s Campaign Is Posting About a Dead Squirrel,2024-11-04 21:00:33,N
Kamala Harris is the right choice for Jewish Michiganders,2024-11-04 16:40:00,D
Donald Trump Facing 'Red Flags' in State He Won Twice,2024-11-04 07:14:05,D
Trump talks about reporters being shot and says he shouldn't have left White House after 2020 loss,2024-11-04 18:50:48,R
"GOP’s closing election message on health baffles strategists, worries experts",2024-11-04 01:28:17,N
Musk PAC tells Philadelphia judge the $1 million sweepstakes winners are not chosen by chance,2024-11-04 16:11:12,N
A Virginia principal went to vote. She was asked whether she was a citizen.,2024-11-04 22:00:13,N
George Clooney narrates advert urging male Trump supporters to vote for Harris,2024-11-04 22:54:03,D
"Democrats have long attracted celebrity support, but no one has deployed them quite like this",2024-11-04 23:01:07,D
How Slandering Puerto Ricans Harms the GOP,2024-11-04 17:19:49,N
I’ve Covered Authoritarians Abroad. Now I Fear One at Home.,2024-11-04 04:55:12,D
Harris and Trump will both make a furious last-day push before Election Day,2024-11-04 20:48:32,N
Trump’s offensive against the free press takes an unsettling turn,2024-11-04 13:33:21,D
Harris and Trump are making a furious last-day push before Election Day ,2024-11-04 04:18:19,N
New York Dem Ritchie Torres discusses the fight for LGBTQ+ representation as election looms,2024-11-04 18:52:03,N
Trump and His Voters: They Like the Lying,2024-11-04 22:00:59,N
‘I grew up in an autocracy. I do not want to die in one.’,2024-11-04 22:11:24,D
2024’s biggest gaffe? GOP telling the truth about what it will do to America.,2024-11-04 13:57:15,N
New York Board of Elections releases unofficial early vote tallies,2024-11-04 12:24:11,N
Volunteers with wheelchair vans are ensuring disabled voters have a say on Election Day,2024-11-04 14:42:04,N
Harris leads Trump by 4 points in final PBS News/NPR/Marist poll; gender gap closes,2024-11-04 09:18:16,N
Texas OB-GYNs urge lawmakers to change abortion laws after reports on pregnant women's deaths,2024-11-04 22:03:53,N
"Alicia Keys, Michelle Obama to campaign in Pennsylvania for Kamala Harris",2024-11-04 15:51:12,N
You will pay for Donald Trump’s tariffs if he’s reelected. Here’s proof,2024-11-04 07:42:51,D
Election Deniers Are Out in Full Force. We Went Where They Did,2024-11-04 21:45:19,D
Thousands of Trump supporters mobilized to block election certification,2024-11-04 02:09:34,D
Philadelphia DA issues warning against voter interference: ‘Eff around and find out’,2024-11-04 19:06:18,N
Ad Man,2024-11-04 15:23:16,N
"In a frank internal meeting, The New York Times wrestled with its political role",2024-11-04 10:43:58,N
"In Montana, Republican Tim Sheehy Tries to Outrun Jon Tester, and Scrutiny",2024-11-04 15:09:27,R
Kamala Harris' chances of winning election skyrocket in final days,2024-11-04 15:56:10,D
The case for Arab and Muslim Americans to rally behind Kamala Harris,2024-11-04 17:07:09,D
Judge denies Philadelphia DA's request to block Elon Musk's $1 million giveaway,2024-11-04 10:22:13,N
The One Institution That Checked Trump,2024-11-04 16:41:01,N
Federal Union Slams Montana GOP Senate Candidate’s ‘Disdain’ For Wildland Firefighters. The blistering remarks come after HuffPost first revealed that Tim Sheehy accused wildland firefighters of laziness and “milking” fires for overtime pay.,2024-11-04 11:18:19,D
Right-Wing Extremists Are Making Big Plans for Election Day,2024-11-04 15:11:04,D
How Peanut the Squirrel became the center of a MAGA firestorm,2024-11-04 12:33:33,D
Donald Trump's Hometown Stronghold Endorses Kamala Harris,2024-11-04 19:01:33,D
A Final Plea To Nikki Haley Voters,2024-11-04 03:25:14,N
"Trump Isn't Playing to Win the Election, He's Plotting to Steal It",2024-11-04 12:47:42,D
"The End of the Whole-of-Government Approach? | In the Biden administration, some officials actually tried to govern. The squealing from corporations made clear that this novelty was effective.",2024-11-04 19:06:58,D
'I was as shocked as anyone': Pollster finds Harris lead in Iowa,2024-11-04 18:57:26,D
"On Telegram, a Violent Preview of What May Unfold on Election Day and After",2024-11-04 17:24:32,N
"Discussion Thread: Assorted National Campaign Events for November 4, 2024",2024-11-04 08:09:38,N
RFK Jr.’s public health plans under Trump rattle critics,2024-11-04 13:15:33,N
Election Day is Tuesday. Here's what it'll look like that night.,2024-11-04 19:02:25,N
Kamala Harris leads Michigan in 3-point swing with Republican pollster,2024-11-04 17:21:41,N
Arizona Democrats Are Ready to Bury Kari Lake’s Non-Career,2024-11-04 19:02:37,N
Federal Reserve is set to cut rates again while facing a hazy post-election outlook,2024-11-04 21:45:51,N
Selzer’s surprise: Why the Roe reckoning may finally be here for Donald Trump,2024-11-04 15:50:10,N
Examining how economic plans from Trump and Harris could affect inflation,2024-11-04 12:36:08,N
Tyranny Expert Exposes Donald Trump ‘Trick’ That Can Be Toppled ‘With My Little Finger’,2024-11-04 13:59:39,N
Trump’s Closing Message to Voters Just Got Even More Dark: Donald Trump is revealing how little he cares for democracy—and how his second term will be all about retribution.,2024-11-04 20:36:41,N
Editor Jon Ralston’s 2024 Nevada election predictions,2024-11-04 12:35:23,N
"Laptop, smartphone, and game console prices could soar after the election",2024-11-04 01:26:48,N
"On November 5, I will vote against genocide",2024-11-04 17:47:37,N
"Daily Discussion Hub for November 4, 2024",2024-11-04 18:59:27,N
"Harris aims to run up women’s vote with ‘What happens in the booth, stays in the booth’ ads",2024-11-04 14:59:42,N
"Musk's America PAC can keep writing checks to voters, judge says",2024-11-04 22:47:18,N
Philly DA on election security: ‘F around and find out’,2024-11-04 22:06:41,N
Trump Goes Off-Script At Final Campaign Rally And Shares Ominous Prediction,2024-11-04 13:01:57,D
Trump eyes Herschel Walker for U.S. missile defense role,2024-11-04 21:52:32,R
I followed Harris and Trump round North Carolina. It’s clear who’s going to win,2024-11-04 14:26:17,N
Trump’s lead over Harris in betting market erodes as platforms tighten odds,2024-11-04 12:47:26,N
Which states are voting on legalizing weed? Here's where marijuana is on the ballot tomorrow,2024-11-04 22:11:53,N
Secretaries of state ask social media companies for moderation plans on election day ,2024-11-04 18:06:19,N
"Fraud, lawsuits, chaos: how Trump is preparing to contest the 2024 election",2024-11-04 14:13:57,D
The GOP Scapegoating of Haitian Immigrants is Despicable,2024-11-04 17:27:40,N
Supreme Court gives second-chance ballot access to thousands in Pennsylvania,2024-11-04 18:03:15,N
"Minnesota law bans harassment, intimidation of election workers",2024-11-04 11:29:31,N
Axelrod: Trump not ‘closing well’,2024-11-04 15:14:11,D
Kathy Hochul’s ‘anti-American’ gaslighting — final proof Dems don’t dare discuss the real issues,2024-11-04 04:58:27,R
The presidential election will likely come down to Pennsylvania. And it’s really close.,2024-11-04 00:21:07,N
You Didn’t Imagine It. The Election Had a Vibe Shift.,2024-11-04 19:56:35,N
Poll: Harris has massive lead among swing state college students,2024-11-04 18:35:38,D
"Not sold on Harris over Gaza yet anti-Trump, some Pa. activists are asking blue-state voters to cast protest ballots on their behalf",2024-11-04 18:39:35,D
All eyes on Pennsylvania in final hours of epic battle for White House,2024-11-04 21:26:02,N
New poll spells hope for Harris as she leads Trump in four key swing states,2024-11-04 15:21:28,N
An Immigrant Workforce Thrives in Georgia’s MAGA Heartland,2024-11-04 11:42:18,N
Texas Teen Suffering Miscarriage Dies Days After Baby Shower Due to Abortion Ban as Mom Begs Doctors to 'Do Something,2024-11-04 19:00:30,N
Pollster Behind Shock Iowa Poll Hits Back at Trump’s Attacks,2024-11-04 20:23:55,N
U.S. Republicans Are Embracing Mussolini’s Motherhood Agenda,2024-11-04 13:14:20,N
Worries Grow Over Trump Prematurely Claiming 2024 Victory,2024-11-04 22:51:33,N
When polls close on Election Day in these 7 battleground states,2024-11-04 16:10:08,N
"Ella Emhoff, Second Daughter of New York’s Downtown",2024-11-04 19:17:36,N
Final polls reveal Trump faces huge gender gap as women flock to Harris,2024-11-04 03:42:12,D
Sam Alito Got Knighted... Just Like The Founding Fathers EXPLICITLY MADE UNCONSTITUTIONAL,2024-11-03 23:44:20,D
Kamala Harris flips battleground state in Electoral College map model,2024-11-04 11:01:26,D
10 reasons both Harris and Trump can be hopeful of victory,2024-11-04 12:25:11,N
How Donald Trump rally crowds have shrunk since 2016,2024-11-04 21:49:51,D
Nancy Pelosi Has Dire Prediction For Trump's 'Deteriorating' Brain,2024-11-04 11:27:51,D
Shock Poll Showing Harris Leading in Iowa Energizes State Democrats,2024-11-04 21:20:16,D
Trump's once enthusiastic crowds dwindle in election's closing days,2024-11-04 17:21:37,D
Missouri secretary of state sues Justice Department to block election monitors for St. Louis,2024-11-04 22:24:07,R
And Now RFK Jr. Attempts To Distract Us With Some Bullsh*t About Fluoride,2024-11-04 20:30:58,D
Trump indicates he is open to RFK Jr’s proposal to ban vaccines if elected ,2024-11-04 09:46:02,R
Election betting sites pour money into social media ads,2024-11-04 21:31:21,N
How the World Is Prepping for a Trump or Harris Victory,2024-11-04 13:22:51,N
Harris has 4-point lead over Trump in final PBS News/NPR/Marist election poll,2024-11-04 20:02:14,D
